{
  "schema_version": "1.0.0",
  "policy_version": "0.1",
  "case": {
    "case_id": "illustrative-sendai-corridor",
    "case_slug": "illustrative-sendai-corridor",
    "revision": 1,
    "created_at_utc": "2026-07-31T00:00:00Z",
    "created_by": "fixture-author"
  },
  "scenario": {
    "scenario_id": "illustrative-sendai-corridor",
    "event_id": "illustrative-tohoku",
    "target_site": "sendai-illustrative",
    "model_family": "regional_2d"
  },
  "coordinate_frame": {
    "horizontal_crs": "TEST:EN-METRIC-SENDAI-1",
    "vertical_datum": "synthetic-vertical-datum",
    "horizontal_unit": "m",
    "vertical_unit": "m",
    "axis_order": "east_north",
    "vertical_positive": "up"
  },
  "datasets": {
    "manifest_path": "manifests/datasets.json",
    "bindings": {
      "bathymetry": "corridor-bathymetry",
      "topography": "corridor-topography",
      "earthquake_displacement": null,
      "prescribed_surface": null,
      "manning": null,
      "coriolis": null,
      "observations": []
    }
  },
  "regional_2d": {
    "corridor": {
      "trajectory_id": "sendai-illustrative",
      "origin": { "x": -2000.0, "y": 1000.0 },
      "bearing_degrees_clockwise_from_north": 90.0,
      "width_m": 300.0,
      "offshore_extent_m": 500.0,
      "inland_extent_m": 500.0,
      "narrowing": { "enabled": true, "inland_width_m": 120.0 },
      "sponge": { "offshore_width_m": 50.0, "side_width_m": 20.0 }
    },
    "physics": {
      "gravity_m_per_s2": 9.80665,
      "manning": { "kind": "disabled", "value_s_per_m_one_third": null, "dataset_binding": null },
      "coriolis": { "kind": "disabled", "value_per_s": null, "dataset_binding": null },
      "earthquake": { "enabled": false, "displacement_binding": null, "bed_mapping": "vertical_only", "surface_transfer": "passive_equal_to_effective_bed", "prescribed_surface_binding": null }
    },
    "numerics": {
      "scheme": "ssprk3",
      "courant_number": 0.45,
      "positivity_safety_factor": 0.95,
      "relaxation_safety_factor": 1.0,
      "source_safety_factor": 1.0,
      "minimum_timestep_s": 0.001,
      "maximum_timestep_s": 1.0,
      "final_time_s": 60.0,
      "maximum_steps": 1000
    },
    "boundaries": {
      "offshore": { "kind": "radiation" },
      "inland": { "kind": "transmissive" },
      "left_side": { "kind": "radiation" },
      "right_side": { "kind": "radiation" },
      "relaxation": { "enabled": false, "maximum_rate_per_s": null, "profile_exponent": null }
    }
  },
  "outputs": {
    "snapshot_interval_s": 30.0,
    "diagnostics_enabled": true,
    "initialisation_diagnostics_enabled": true,
    "checkpoint_interval_s": null
  },
  "extensions": {
    "fixture_disclaimer": {
      "status": "illustrative",
      "authority": "non-authoritative",
      "scientific_validation": "not suitable for scientific validation",
      "note": "Coordinates and dimensions are synthetic controls, not accepted production Sendai geometry."
    }
  }
}
